{
  "source_id": "SRC-fmars-c15-crew-announcements",
  "mission_ids": ["FMARS-C15-2023"],
  "url_or_reference": "https://www.marssociety.org/news/2023/07/06/multi-national-crew-to-visit-fmars-canada-for-upgrade-work-science-mission/ ; https://www.marssociety.org/news/2023/07/19/back-on-mars-crew-arrives-at-fmars-on-devon-island-for-4-week-mission/ ; https://www.marssociety.org/news/2023/08/21/international-crew-concludes-multi-week-mission-to-fmars-in-northern-canada/",
  "source_type": "official_report",
  "covers": ["crew"],
  "date_range_or_sols": "Mars Society news announcements, July-August 2023, covering FMARS Crew 15",
  "discovery_method": "agent",
  "approved_by": "ASG",
  "approved_date": "2026-08-26"
}
